{
  "schema_kind": "odd_world_model.temporal_reference_artifact",
  "schema_version": "v1",
  "artifact_id": "odd_world_model.reference_artifact.apra_liquidity.counterparty_bucket_set.v1",
  "artifact_kind": "classification_set",
  "bounded_context": "sandbox.apra_liquidity.reference_data",
  "semantic_role": "Minimal APRA-style counterparty bucket reference set.",
  "identity": {
    "authority_basis": "sandbox.apra_liquidity.reference_data",
    "aliases": [
      "counterparty_bucket_set_v1"
    ]
  },
  "effective_period": {
    "effective_from": "2026-01-01T00:00:00Z"
  },
  "values": [
    {
      "value_code": "financial_institution",
      "value_label": "Financial Institution",
      "value_meaning": "Counterparty treated as a financial institution for sandbox APRA-liquidity classification.",
      "effective_from": "2026-01-01T00:00:00Z",
      "status": "active"
    },
    {
      "value_code": "non_financial_corporate",
      "value_label": "Non-Financial Corporate",
      "value_meaning": "Counterparty treated as a non-financial corporate for sandbox APRA-liquidity classification.",
      "effective_from": "2026-01-01T00:00:00Z",
      "status": "active"
    }
  ],
  "supersession": {},
  "evidence": {
    "refs": [
      "input://apra_liquidity/requirements_snapshot.json"
    ],
    "summary": "Minimal reference artifact example for changing bucket semantics."
  },
  "usage": {
    "object_refs": [
      "odd_world_model.world_model_object.apra_liquidity.counterparty_bucket.financial_institution"
    ],
    "attribute_refs": [
      "odd_world_model.attribute.apra_liquidity.reporting_position.counterparty_bucket"
    ],
    "treatment_refs": [
      "odd_world_model.treatment.apra_liquidity.reporting_position.classification.v1"
    ]
  },
  "composition": {
    "fragment_id": "odd_world_model.fragment.reference_artifact.counterparty_bucket.v1",
    "parent_object_refs": [],
    "child_object_refs": []
  }
}
